{
  "Timestamp": "1788271397412000000",
  "EventName": "ai.tool.executed",
  "Resource": {
    "service.name": "workload-research-agent"
  },
  "InstrumentationScope": {
    "name": "ai-forensic-readiness",
    "version": "0.2.0-draft"
  },
  "Attributes": {
    "afr.event_id": "evt-0007",
    "afr.schema_version": "0.2.0-draft",
    "afr.trace_id": "trace-case-001",
    "afr.session_id": "session-synthetic-001",
    "afr.mapping_notes": [
      "Logical Logs Data Model JSON; not an OTLP wire payload.",
      "No sampling or span ancestry is invented; the original envelope remains in Body.",
      "Source trace ID is not a valid W3C TraceId; retained only as afr.trace_id."
    ]
  },
  "Body": {
    "ai_forensic_readiness": {
      "schema_version": "0.2.0-draft",
      "event_id": "evt-0007",
      "event_type": "ai.tool.executed",
      "timestamp": "2026-09-01T14:03:17.412Z",
      "observed_at": "2026-09-01T14:03:17.501Z",
      "sequence": 7,
      "correlation": {
        "trace_id": "trace-case-001",
        "session_id": "session-synthetic-001",
        "task_id": "task-collect-public-report",
        "parent_event_id": "evt-0006"
      },
      "principal": {
        "human_id": "user-synthetic-01",
        "agent_id": "research-agent",
        "runtime_identity": "workload-research-agent",
        "delegated_identity": "synthetic-doc-reader",
        "tenant_id": "lab-tenant",
        "authority_ref": "authz-0003"
      },
      "ai_component": {
        "agent_version": "0.3.1-lab",
        "model_id": "synthetic-model",
        "model_version": "2026-08-lab",
        "provider": "laboratory",
        "system_prompt_version": "sha256:example-system-prompt",
        "policy_version": "policy-lab-004"
      },
      "influence": {
        "instruction_ref": "evidence/instructions/user-0001.json",
        "retrieved_context_refs": [
          "evidence/retrieval/malicious-page-0002.json"
        ],
        "memory_read_refs": [],
        "provenance_refs": [
          "source/synthetic-web-0002"
        ]
      },
      "decision": {
        "plan_step": "Read the requested document using the delegated reader.",
        "policy_decision": "allow",
        "approval_required": false,
        "consequence": "high",
        "reversibility_at_authorization": "R0",
        "policy_rule_id": "rule-read-only",
        "evaluated_input_refs": [
          "synthetic://conformance/request-1"
        ]
      },
      "action": {
        "tool_id": "synthetic-document-reader",
        "tool_version": "1.0.0",
        "operation": "read_document",
        "arguments_digest": "sha256:example-arguments-digest",
        "target": "synthetic://documents/report-17",
        "outcome": "succeeded",
        "result_ref": "evidence/tool-results/result-0007.json",
        "retry_count": 0
      },
      "integrity": {
        "collector": "lab-evidence-gateway",
        "hash_algorithm": "none",
        "retention_class": "case-evidence-365d",
        "access_label": "synthetic-restricted"
      },
      "evidence_refs": [
        "synthetic://conformance/tool-receipt-1"
      ],
      "evidence_quality": {
        "capture_status": "complete",
        "confidence": "confirmed",
        "limitations": [
          "Synthetic conformance example; no real execution."
        ]
      }
    }
  },
  "ObservedTimestamp": "1788271397501000000"
}
